436,Trip,Production several magazine sign act outside tough. Scientist happen worry choose market. Environment and science beat industry hear view. Truth especially event month arm education.,https://picsum.photos/id/42/400,Books
437,Heavy,Present money size improve note our. Similar born best discussion father. Grow scene hospital president establish argue. Or require fill short.,https://picsum.photos/id/34/400,Books
438,Almost,World join model usually. Among safe pressure life one month report.,https://picsum.photos/id/381/400,Music
439,Everyone effort,Method establish wonder decide environmental interesting. World individual treat word memory half music wind.,https://picsum.photos/id/110/400,Books
440,Stop,Chance subject majority year. City fill arrive ready notice. Education woman never body project right. New for people wide live do security.,https://picsum.photos/id/146/400,Music
441,Send born,Million never hope gas. Then sure race. Policy town guy them.,https://picsum.photos/id/115/400,Books
442,Yet baby,Describe between loss goal sea seem Republican. Trial southern west hit take.,https://picsum.photos/id/491/400,Books
443,Simple federal,Modern could yet design form. Inside continue break where may growth quite. Dark wear hospital whose past we. Too community enough pick movement bar race. Away across music police.,https://picsum.photos/id/284/400,Movies
444,Employee business,Fine center have. Protect star field everything very management add light. Child red international school answer. Late certainly project rise like side.,https://picsum.photos/id/358/400,Movies
445,Oil research,Produce artist yet public spend once stuff somebody. Whose generation cold collection attention hand old.,https://picsum.photos/id/127/400,Movies
446,Sense remain,Test sport reality box scene laugh. Class far city early manage heart. Lead later let pull case should budget new. Treatment hold bar wife.,https://picsum.photos/id/268/400,Books
447,Idea sign,Price cup general civil southern politics. Light try win turn with above goal idea. Every machine contain nice scientist green. Hear expert decision lawyer out.,https://picsum.photos/id/19/400,Music
448,Building four,Rule reality happen probably address threat. Second series condition according product. Something space store party surface story. Bank stock bank agree be above imagine.,https://picsum.photos/id/490/400,Music
449,Lead new,These attention defense would. Wish message check if protect. Common Democrat final keep environment front. Yet shake will season people. Commercial street ahead magazine better.,https://picsum.photos/id/253/400,Music
450,Hold,Take artist international sort improve health way. Morning beat population conference. Create once side and concern local population film. Positive option serious minute.,https://picsum.photos/id/334/400,Music
451,Order make,Candidate quickly product surface pressure any church. Concern feeling attack never try professional. Us game stay little three southern but. Good thing mother red outside skin.,https://picsum.photos/id/399/400,Books
452,Industry over,Daughter organization star beyond ahead company discussion. Start professional clearly take natural sit once. Couple walk sort official whom ago all. Sure during certain just. President explain town during owner.,https://picsum.photos/id/265/400,Movies
453,Vote tell,Base professor develop candidate respond behavior. Low election I like. Throw care learn seven trade small.,https://picsum.photos/id/60/400,Movies
454,Collection meeting,Finally might already sister memory. Skin because sometimes along. Size into together goal need. Able night foreign.,https://picsum.photos/id/373/400,Books
455,Ok,Television southern dark industry red. Mother matter billion. Tax environmental from medical start fact.,https://picsum.photos/id/480/400,Movies
456,Later moment,Movement north word none. Focus serve order improve age through. Similar rate to hear religious trade hotel.,https://picsum.photos/id/173/400,Books
457,Base that,Sing body popular project factor study. Family simply speak heavy. See through Republican.,https://picsum.photos/id/452/400,Books
458,Still,Majority treatment American fill design. Animal let good. Either social person would rule pay TV. Available image thought season score particular.,https://picsum.photos/id/359/400,Books
459,Sound,As difference pattern realize language notice board. Hair model arrive hospital.,https://picsum.photos/id/293/400,Music
460,Whom official,Home short image kind politics it however. Power Congress should head wind structure fill be. Allow office culture same mind.,https://picsum.photos/id/236/400,Movies
461,Somebody section,Nearly exactly contain market skill. Field police put decade us. Morning skill animal century professional. Several want history brother fine. Wall forget somebody rich fact wish center.,https://picsum.photos/id/358/400,Books
462,Return,He sense treatment within PM people provide. Help fill tree night entire skill. Wall then support art visit.,https://picsum.photos/id/181/400,Music
463,Dark lawyer,Ahead something article leave. Whole your close own.,https://picsum.photos/id/350/400,Books
464,Organization line,I good recognize condition together material along. Get tell bit account across treatment use.,https://picsum.photos/id/326/400,Books
465,Car land,Particularly medical keep sell responsibility summer. Those rule affect toward measure rate to movement. Indeed world baby western. Place democratic eight understand. Some happen play mention focus.,https://picsum.photos/id/145/400,Movies
466,Most board,Modern fear enjoy. Really team group old.,https://picsum.photos/id/243/400,Books
467,Much,Draw board I gun hour push onto ready. Risk yet animal role country appear eye. Toward lawyer administration available wait summer.,https://picsum.photos/id/269/400,Movies
468,End offer,Activity night executive one maintain amount. Quite type or. Assume yeah there hotel. Throw to science close enjoy value.,https://picsum.photos/id/316/400,Movies
469,Brother,Either remember young decision shoulder which deal message. Or wear eye heavy man all memory. Head little option style approach officer country. Factor chair hour. Represent particularly director role approach enjoy family.,https://picsum.photos/id/40/400,Books
470,Minute any,Decision executive training might why. Speak bill rate. Discover family property for all building. Area worry success discuss. Owner pretty available seven increase yard identify nothing.,https://picsum.photos/id/115/400,Books
471,Drive,Single professor rest believe final sea me out. Often least every success. List lose actually place. Wind trial act how teach air.,https://picsum.photos/id/400/400,Movies
472,Radio,Interest begin agreement positive although available population last. Everyone nothing size significant candidate sell. Measure bed show evidence.,https://picsum.photos/id/342/400,Books
473,Civil,Mention civil technology view possible culture. Happy spring seek second still peace hotel argue. Lead half cut not. Miss prove sound fund no. State available toward color explain strong.,https://picsum.photos/id/294/400,Movies
474,Machine,Young raise pay case. Evidence leader better drive interview street personal without. Hair ten area. Part dream woman form key.,https://picsum.photos/id/198/400,Music
475,Five author,Though accept heart small early. Person information talk.,https://picsum.photos/id/108/400,Movies
476,Easy,Possible direction media professor tax across personal. Democrat long change and represent. Evidence defense red nor customer break specific.,https://picsum.photos/id/187/400,Movies
477,View,Special minute spend herself page clear popular. Reduce employee view be mention truth attorney.,https://picsum.photos/id/326/400,Music
478,Police,Style enter relationship left report to anything. Pick party think. His dinner air better kid game above. Argue plant face hold no care wear performance. Player music music drug sense school great from.,https://picsum.photos/id/436/400,Movies
479,Hundred step,Produce girl stop agreement. Suggest away relate suffer future daughter whom. Moment product product blood federal.,https://picsum.photos/id/57/400,Books
480,Play,Human manager hold. Like or physical charge. Success coach item remain. Friend fact end social.,https://picsum.photos/id/236/400,Books
481,National opportunity,Play few enough fast. Send learn big doctor hard staff.,https://picsum.photos/id/197/400,Books
482,Choose,Laugh always pressure. Suddenly group again deep. I full big order. Again ball unit by should.,https://picsum.photos/id/190/400,Music
483,Catch,Food sure responsibility then election write. Go fall into nature among body go. Government run high high hit point thousand. Leave rest visit year doctor. Against personal general exist tax wife race.,https://picsum.photos/id/328/400,Movies
484,Security claim,Actually possible middle great artist general explain body. Traditional since benefit near project serve difference. Gun often by every people now reduce get.,https://picsum.photos/id/351/400,Music
485,Everyone check,To eat agency despite fact. Manage section require audience guy. In attorney raise past upon owner training.,https://picsum.photos/id/332/400,Music
486,Serious,Approach own military perhaps top set. Energy actually son listen federal thing teach. Inside on increase TV room Mr behind.,https://picsum.photos/id/458/400,Movies
487,Home few,Child poor offer common than hair many. Actually later good fire view. Only although boy involve tonight third like. Much even begin land.,https://picsum.photos/id/489/400,Music
488,Every family,Heavy network one a. Much wish force. All sign rather community pick.,https://picsum.photos/id/51/400,Music
489,Simply indicate,Avoid organization decide matter civil. Measure picture everybody dark. Religious reach agree simple such.,https://picsum.photos/id/65/400,Books
490,Cause American,Behind usually agency finish put. Keep reduce turn positive relationship power. Full prepare figure law.,https://picsum.photos/id/23/400,Books
491,Talk our,Form ten rather contain relate eat interesting. Service try himself everybody. Contain art wide maybe. Understand work glass reflect none deep natural.,https://picsum.photos/id/209/400,Music
492,Put dinner,Must medical history pick edge. Could good clear himself. Open important lawyer third. Article so difficult beat. Animal phone shake billion finish effort.,https://picsum.photos/id/71/400,Movies
493,Amount thousand,Article officer clearly practice main lead. Light figure know attorney. Direction sport need wind.,https://picsum.photos/id/78/400,Music
494,Establish,Base we see care control not. Move shake country nearly least share. Store field meet beat painting himself shake way.,https://picsum.photos/id/339/400,Books
495,Only member,Both student want spring stop significant sister whole. Consider bag under whether then weight. Contain back according. Onto strong work analysis offer.,https://picsum.photos/id/423/400,Music
496,Stage,Debate test thus inside add economic trade. Son above field office.,https://picsum.photos/id/129/400,Movies
497,Place treatment,Partner establish TV issue history animal. Amount score contain should. Above visit reduce parent. Them factor open food.,https://picsum.photos/id/166/400,Books
498,Event,Surface author tend. Discussion various take with. Control form four event. Southern will information left born work. Affect try economy change democratic up.,https://picsum.photos/id/124/400,Movies
499,Book,Floor just I major budget evidence interest. Left small prepare see. Finish campaign two environmental trade large. Listen person talk throughout.,https://picsum.photos/id/8/400,Movies
500,Sort grow,Performance wait believe never. Environment final prepare recognize city story. Protect all anyone between recognize personal establish.,https://picsum.photos/id/206/400,Movies
501,Assume,Run do kid contain. Land style house do. Wish bag amount different many. Catch network message raise success.,https://picsum.photos/id/89/400,Music
502,Visit,Almost try say carry carry. Arrive race grow mention growth product trial set. Left find southern apply many.,https://picsum.photos/id/92/400,Books
503,Manager national,These force relationship ask behavior attack. Story western necessary like big party million. By participant brother whom break rather push purpose.,https://picsum.photos/id/182/400,Books
504,Indeed pay,Around research international stock. Rise religious run compare face.,https://picsum.photos/id/213/400,Movies
505,Cold thought,Business song growth high interview traditional collection. Hundred whole baby eye enjoy face conference.,https://picsum.photos/id/154/400,Movies
506,Throw power,Six two hair itself model public popular could. Protect social without likely. Wait fire possible one mission production arrive.,https://picsum.photos/id/259/400,Music
507,Bag,Media less product call. Prepare old open project though production seat. Among budget guess down stock guess position.,https://picsum.photos/id/331/400,Movies
508,Indeed style,Whole their herself available these statement. Entire glass child material think company. Hot religious main work. Top heart nice weight style. Career traditional view open inside.,https://picsum.photos/id/267/400,Music
509,Lawyer where,Friend central avoid could. Rate cold short. Speak take technology poor. Other for describe world.,https://picsum.photos/id/304/400,Music
510,Role,Although rest everyone. Enter choose quality girl. Song environment former some difficult easy.,https://picsum.photos/id/66/400,Music
511,Shake station,Development learn young one particularly. Enjoy these later. Attorney family machine seek go that TV.,https://picsum.photos/id/443/400,Music
512,Key past,Environmental how drive detail drop pick. Management sport TV nation blue.,https://picsum.photos/id/123/400,Movies
513,Total forward,Name more friend less full cultural. Across someone however feel between work end green. Scene quickly we. Morning specific crime. Claim professional avoid feel.,https://picsum.photos/id/82/400,Books
514,Upon item,South site dark while event land. Majority expect center.,https://picsum.photos/id/239/400,Books
515,Country,Indicate test professor. Care recognize production nor for as full.,https://picsum.photos/id/101/400,Music
516,Grow prepare,Require drop on account floor. Bank five before always such. Include million catch use. Family might the system sure. Would carry PM property number hope owner.,https://picsum.photos/id/202/400,Movies
517,Enough,Place during together million cell. Morning outside agree dinner tough doctor use. Star its either choose protect.,https://picsum.photos/id/297/400,Music
518,Group,Camera statement should best. Nothing kind of concern remember throughout. Enter trial draw better Republican production. Difference base amount peace add. Effort age billion thank respond.,https://picsum.photos/id/264/400,Music
519,First,Allow water food month. She sure six college suggest. Design clear step record huge newspaper. Food answer everyone score side but manager situation.,https://picsum.photos/id/85/400,Books
520,Protect,Figure American ready long oil across. Country break best sure lead final table gun. Next last soldier whole.,https://picsum.photos/id/84/400,Music
521,Want level,Should special finish by treat name. College interest local part church professor. Reflect nothing middle ask TV table ago computer. Plant we maintain practice stock opportunity dream.,https://picsum.photos/id/97/400,Books
522,Employee hear,Pick according direction pretty shake way sort west. Stuff total leg about major. Arrive play candidate pay light better catch. Official cultural themselves parent base simple. Far pattern picture nature audience.,https://picsum.photos/id/105/400,Music
523,Family,Pay huge different protect half to. Vote range support lot know actually forward down.,https://picsum.photos/id/182/400,Movies
524,Focus,Seven structure step three result bed tonight. Agency miss officer continue. Young nothing determine describe oil modern.,https://picsum.photos/id/13/400,Movies
525,Become,Health avoid area kid fund charge. Threat soldier yet decide.,https://picsum.photos/id/464/400,Books
526,Certainly,Alone challenge media under. Development professional card certainly can.,https://picsum.photos/id/245/400,Music
527,Social author,National behind magazine investment speech on this. Building seat during teach. Within although identify role entire increase arrive. Follow tell business rest.,https://picsum.photos/id/413/400,Movies
528,Response stand,Head player family will against say. Speak base information test step fill newspaper. Remain should gas ask.,https://picsum.photos/id/246/400,Movies
529,Couple color,Herself imagine pay because second lead. Value everyone environment also civil everything ground.,https://picsum.photos/id/474/400,Music
530,Though,Argue it seat whose under after outside score. Home cover campaign rate personal public fire prepare. Discussion phone billion often free doctor offer.,https://picsum.photos/id/277/400,Books
531,Capital list,Down how add. Good surface week throw federal.,https://picsum.photos/id/90/400,Movies
532,Wrong series,Clearly production risk media various. Serve piece ok situation one.,https://picsum.photos/id/162/400,Movies
533,Current,Performance understand success. On almost traditional standard issue apply. Win western civil dinner brother special several. Indicate person prove yourself would wide plant quickly.,https://picsum.photos/id/222/400,Movies
534,Hotel foreign,Early civil series material who suddenly. Ball perhaps ahead indeed operation address. Really early financial bit green visit sign. Success employee like campaign trouble.,https://picsum.photos/id/2/400,Books
535,Able,Officer fly tend morning pass collection worry. Together hard put own. Job wide laugh.,https://picsum.photos/id/153/400,Movies
536,Number positive,Against consider who. Green doctor front science everyone imagine during. Chair walk stuff break key one.,https://picsum.photos/id/442/400,Movies
537,Kid,Must position second all study week. Stand table kind accept tonight away miss. How education begin see necessary.,https://picsum.photos/id/479/400,Music
538,Authority performance,School per sure person radio building city. Trade TV his expert exactly establish benefit. Audience any card. Together near how operation company enjoy must.,https://picsum.photos/id/2/400,Music
539,List,Down measure power perhaps. Discuss would administration staff shoulder agree table. Parent him wrong. Good across city left check leg every down. Reduce up through identify.,https://picsum.photos/id/283/400,Books
540,Several,Only thing us modern buy. Center any daughter everyone. Tonight remember plan seven. Expect now them century almost ability. Manager table entire he.,https://picsum.photos/id/180/400,Movies
541,Want clear,Into economic local short Mrs. Assume best stand door thus develop. Heart know official guess long edge standard. Really evening then our.,https://picsum.photos/id/339/400,Books
542,Why per,Thing building personal team. Focus parent account own. Hotel since article meet.,https://picsum.photos/id/12/400,Books
543,Surface,Almost any research because. Common church street activity imagine. Choose against name ability anything employee.,https://picsum.photos/id/55/400,Movies
544,College,Bar method tree person food smile certain dinner. Seven pay family way seek country exactly song. Myself short make week send. Cost weight lead free.,https://picsum.photos/id/283/400,Music
545,Eight than,Anyone then mind standard character when production. Fill pattern course throw view budget age hit.,https://picsum.photos/id/158/400,Music
546,Use measure,Within free yourself age mind. Name list building focus.,https://picsum.photos/id/172/400,Music
547,Actually last,Cut middle indicate myself concern usually grow. Both child game low color including probably. Interesting certain project.,https://picsum.photos/id/388/400,Music
548,Scientist treatment,More star wonder down. High foreign increase floor sing.,https://picsum.photos/id/190/400,Books
549,Instead,Total green increase candidate wonder. Recent lawyer adult color she give share. Body return affect reason meeting. Ok pattern space prove improve. Organization so phone.,https://picsum.photos/id/285/400,Music
550,There,Receive moment woman increase crime notice. Such recognize common book or forward. Live always deep step present machine lay understand.,https://picsum.photos/id/391/400,Music
551,Thank,New whatever perhaps similar camera bar. Go point people traditional already skill. Whose modern create become authority.,https://picsum.photos/id/25/400,Books
552,Develop,American two region practice move exactly sea important. Child avoid industry they establish. Common memory soldier relationship maybe travel rise.,https://picsum.photos/id/260/400,Music
553,Walk,Region whose green thousand. Know phone political skin.,https://picsum.photos/id/89/400,Books
554,Our,Physical member accept authority great. Huge democratic camera course statement so. Watch would approach in kid understand it general. Play reflect piece member event.,https://picsum.photos/id/298/400,Music
555,Concern section,Against bed protect none. Spring hold base half those fear free. Amount chair measure weight.,https://picsum.photos/id/23/400,Movies
556,Word,Speech figure some compare occur operation. Discussion wonder kitchen which. Design describe design physical already. Know film clearly appear tend yourself room.,https://picsum.photos/id/287/400,Movies
557,Full evidence,Force behind cold second. Region college admit.,https://picsum.photos/id/341/400,Music
558,Truth,Generation tend member author. Family for same pay political nation matter. Common tax half citizen middle respond newspaper. Improve fight kid great.,https://picsum.photos/id/49/400,Movies
559,Cover,Probably event yet heavy. Movie speech suggest forget budget. Might rich degree public provide degree certainly.,https://picsum.photos/id/187/400,Movies
560,Energy,Chair change explain entire move determine green movement. One area drop my. Out also defense perhaps land truth. Marriage put require could television.,https://picsum.photos/id/227/400,Movies
561,Campaign car,Kind order argue. Fall trouble rich determine person miss fire describe.,https://picsum.photos/id/127/400,Movies
562,Body,Western fact three dog. My decision fine stay let.,https://picsum.photos/id/162/400,Music
563,Wonder,Cultural hard field these. Buy specific be couple identify force bit. Ever doctor daughter senior.,https://picsum.photos/id/358/400,Music
564,Imagine,Box party girl treat doctor section research. Laugh them onto. Especially year behind any PM she father believe.,https://picsum.photos/id/44/400,Books
565,Fight,Society election station strong born quality big among. Federal arrive energy green yet candidate certainly. Continue season few only range remain.,https://picsum.photos/id/48/400,Movies
566,Despite,Case know medical. Attention you state age.,https://picsum.photos/id/152/400,Books
567,War capital,Difficult animal order exist letter main herself. Really resource ahead skill.,https://picsum.photos/id/221/400,Movies
568,Particularly,Event skin may himself society case if him. College possible both between plant his. Pattern game test. Style price five hold.,https://picsum.photos/id/102/400,Music
569,On join,Choice level gun region. Goal recent well ago similar pass ability. Hotel low hit rate apply third. Option grow girl.,https://picsum.photos/id/77/400,Music
570,Method,Hair sea three we sister performance capital. Fill half develop. Must least move television ahead.,https://picsum.photos/id/21/400,Movies
571,Difficult,Reason away already threat. After degree loss choice hand final. Raise great cost draw order the heart take. Success wide cause cultural. Rich safe especially war perhaps lead soon rest.,https://picsum.photos/id/459/400,Movies
572,Region,Wish clearly course power animal. People onto ok minute could. Believe candidate surface thank.,https://picsum.photos/id/51/400,Movies
573,None,Challenge news expect table. Or tend word sell list but low scientist. Model goal first pattern tough. Close approach born material great leg. Senior affect computer impact whom.,https://picsum.photos/id/42/400,Music
574,Begin,Provide check stock ever. Fight pass site give remain focus. Series eye any lot. Might first machine certainly response call never. Consumer trade nation future trouble dark at game.,https://picsum.photos/id/352/400,Music
575,Travel get,Marriage scene than customer number lot become. Mean avoid high cover ground. Rock energy as some but set. Clearly outside example should reality fire do ready. Teacher last avoid throughout degree center range leg.,https://picsum.photos/id/482/400,Movies
576,Play base,Both door alone away fund born on Democrat. Hit thing Republican staff father staff. Would reason drop that military PM prevent. Dog our experience consumer.,https://picsum.photos/id/341/400,Music
577,Base,Technology side really family certain. Even group interesting thus investment significant. Near media east billion themselves six.,https://picsum.photos/id/288/400,Movies
578,Night run,Movie team still kitchen employee one sometimes staff. Site teach take safe interview.,https://picsum.photos/id/229/400,Books
579,Affect,Interesting in instead south threat. Let avoid but to sit.,https://picsum.photos/id/455/400,Music
580,Ever bed,Age response fact tonight leader. Certain or trial information design car skin suggest. Serious parent exactly hard goal much themselves. Record other effect son option those. Almost country peace decision ahead there.,https://picsum.photos/id/253/400,Music
581,Course,Rise bring one western data cover news. Foot two without anything. Us heavy resource scene value model determine.,https://picsum.photos/id/251/400,Books
